Category,Titles,Duration,Episodes,Links
Inertia,Infinite Scrolling with Inertia, 29 mins, 1 episode,https://codecourse.com/courses/infinite-scrolling-with-inertia
Inertia,Translations with Laravel and Inertia, 57 mins, 9 episodes,https://codecourse.com/courses/translations-with-laravel-and-inertia
Inertia,Learn Inertia,2 hrs 20 mins, 28 episodes,https://codecourse.com/courses/learn-inertia
Inertia,Build a Forum with Inertia and Laravel,6 hrs 54 mins, 62 episodes,https://codecourse.com/courses/build-a-forum-with-inertia-and-laravel
Inertia,Easy Pagination with Inertia, 16 mins, 1 episode,https://codecourse.com/courses/easy-pagination-with-inertia
Inertia,Installing Inertia from Scratch,1 hr 7 mins, 14 episodes,https://codecourse.com/courses/installing-inertia-from-scratch
Inertia,Flexible Flash Notifications with Inertia, 28 mins, 7 episodes,https://codecourse.com/courses/flexible-flash-notifications-with-inertia
Inertia,Build An Uptime Monitor with Inertia,4 hrs 59 mins, 44 episodes,https://codecourse.com/courses/build-an-uptime-monitor-with-inertia
